{
  "schema_version": 1,
  "job_id": "gallery-reading-notes",
  "publish_target": "reading-notes",
  "source": {
    "kind": "pasted-text",
    "language": "zh",
    "label": "仓库自有学习札记｜读《千脑智能》"
  },
  "source_units": [
    {
      "id": "highlight",
      "excerpt": "理解一个物体，不只要知道碰到了什么，还要知道碰到的是哪里。移动带来位置变化，也让下一次感觉有了可以检验的预测。"
    }
  ],
  "decision": {
    "mode": "poster",
    "tier": "stable",
    "tone": "reflective",
    "reason": "逐字引用仓库自有学习札记，展示原文与想法配对；不冒充书中原句或真实账户划线。"
  },
  "outputs": [
    {
      "id": "notes",
      "basename": "reading-notes.png",
      "source_unit_ids": [
        "highlight"
      ],
      "transformation": "preserve",
      "render_contract": {
        "mode": "poster",
        "variant": "field-notes",
        "tone": "reflective",
        "title": "读书笔记｜位置与预测",
        "source": "仓库自有学习札记 · 非书中原句 / 非账户划线",
        "cards": [
          {
            "title": "主题整理｜参考系让感觉可预测",
            "body": [
              {
                "type": "reading_unit",
                "quote": "理解一个物体，不只要知道碰到了什么，还要知道碰到的是哪里。移动带来位置变化，也让下一次感觉有了可以检验的预测。",
                "thought": "如果没有“我在物体哪里”，感觉只能是碎片；位置才让它们连成模型。"
              }
            ]
          }
        ]
      }
    }
  ]
}
