{
  "schema_version": 3,
  "job_id": "split-overview",
  "publish_target": "article-body",
  "source": {
    "kind": "url",
    "language": "zh",
    "label": "https://web.dev/articles/optimize-lcp ; https://web.dev/articles/optimize-inp ; https://web.dev/articles/optimize-cls ; https://web.dev/articles/vitals"
  },
  "source_units": [
    {
      "id": "action-0",
      "excerpt": "资源发现。让首屏资源更早可见。当 LCP 图片藏在 CSS 或脚本之后、浏览器发现较晚时，检查初始 HTML 与预加载。。只提前发现资源，不能消除下载和渲染阶段的阻塞。",
      "evidence": {
        "kind": "claim",
        "strength": "primary",
        "freshness": "current"
      }
    },
    {
      "id": "action-1",
      "excerpt": "图片体积。减少资源传输时间。当 LCP 图片下载耗时明显时，检查尺寸、压缩与格式，而不是只追求文件更小。。若图片仍等待脚本显示，省下的下载时间未必缩短 LCP。",
      "evidence": {
        "kind": "claim",
        "strength": "primary",
        "freshness": "current"
      }
    },
    {
      "id": "action-2",
      "excerpt": "长任务拆分。给主线程让出执行机会。当交互回调工作太多、后续输入需要排队时，将可拆的工作分到不同任务。。拆分是改变调度，不等于删除工作；仍需测量交互延迟。",
      "evidence": {
        "kind": "claim",
        "strength": "primary",
        "freshness": "current"
      }
    },
    {
      "id": "action-3",
      "excerpt": "非关键工作延后。先呈现本次交互反馈。当回调还承担统计、检查或保存等工作时，区分下一帧必需更新与可延后工作。。延后的工作仍要完成，不应把必要的交互反馈一起推迟。",
      "evidence": {
        "kind": "claim",
        "strength": "primary",
        "freshness": "current"
      }
    },
    {
      "id": "action-4",
      "excerpt": "布局读写调整。避免强制同步布局。当脚本修改样式后立刻读取几何信息、触发反复布局时，检查读写顺序。。先确认布局是瓶颈；这不是缩短所有脚本执行的通用手段。",
      "evidence": {
        "kind": "claim",
        "strength": "primary",
        "freshness": "current"
      }
    },
    {
      "id": "action-5",
      "excerpt": "媒体空间预留。减少加载后的内容位移。当图片或视频加载后挤动下方内容时，提前提供尺寸或宽高比，为媒体预留空间。。只处理对应位移来源；动态插入内容等其他原因仍需排查。",
      "evidence": {
        "kind": "claim",
        "strength": "primary",
        "freshness": "current"
      }
    },
    {
      "id": "boundary",
      "excerpt": "六种动作可以组合，不是互斥方案或收益排名。改动后仍需在真实访问中验证。",
      "evidence": {
        "kind": "claim",
        "strength": "primary",
        "freshness": "current"
      }
    }
  ],
  "decision": {
    "mode": "infograph",
    "tier": "studio",
    "tone": "sharp",
    "selection_source": "user-override",
    "reason": "用户要求比较现有信息图与个人比较札记，同题材同证据"
  },
  "outputs": [
    {
      "id": "split-overview",
      "artifacts": [
        {
          "artifact_index": 1,
          "id": "split-overview",
          "basename": "split-overview.png",
          "role": "comparison",
          "source_unit_ids": [
            "action-0",
            "action-1",
            "action-2",
            "action-3",
            "action-4",
            "action-5",
            "boundary"
          ],
          "transformation": "compress",
          "visual_plan": {
            "core_message": "先按体验问题定位，再到对应详页核对条件。",
            "content_type": "comparison",
            "argument_structure": "compare-contrast",
            "visual_metaphor": null,
            "layout_strategy": "三组症状作为导航，各动作保留名称和职责，清楚标注详页位置",
            "visual_hierarchy": [
              "问题",
              "比较证据",
              "有条件的结论"
            ],
            "avoid_patterns": [
              "无来源收益数字",
              "将阈值冒充实测",
              "不同指标相加"
            ]
          }
        }
      ],
      "render_contract": {
        "mode": "infograph",
        "title": "先定位，再展开",
        "composition_required": true,
        "tone": "sharp",
        "content_html": "<main><header><p class=\"eyebrow\">性能比较札记 · 1/4 · 总览</p><h1>先定位，再展开</h1><p class=\"question\">六种动作，从哪一组开始看？</p></header><section class=\"map\"><h2>内容迟迟不出现 · LCP</h2><p>资源发现：让首屏资源更早可见</p><p>图片体积：减少资源传输时间</p><p class=\"where\">完整条件与边界 → 第 2 页 · 加载</p></section><section class=\"map\"><h2>操作后反馈太慢 · INP</h2><p>长任务拆分：给主线程让出执行机会</p><p>非关键工作延后：先呈现本次交互反馈</p><p>布局读写调整：避免强制同步布局</p><p class=\"where\">完整条件与边界 → 第 3 页 · 交互</p></section><section class=\"map\"><h2>内容突然挪动 · CLS</h2><p>媒体空间预留：减少加载后的内容位移</p><p class=\"where\">完整条件与边界 → 第 4 页 · 位移</p></section><footer class=\"takeaway\"><h2>这是定位页，不是采用结论。</h2><p>六种动作可以组合；先到详页核对条件，再决定<span class=\"unit\">改什么。</span></p></footer><p class=\"navigation\">第 2 页 加载 / 第 3 页 交互 / 第 4 页 位移</p><p class=\"source\">据 web.dev 性能优化文档整理<br>条件与边界含编辑归纳，未提供实测收益。</p></main>",
        "custom_css": ".symptom{font-size:30px;font-weight:400;line-height:1.6;color:var(--accent);margin:30px 0 12px}.option{padding:22px 0;border-top:1px solid var(--hairline)}.option h3{font-size:42px;font-weight:400;line-height:1.6}.purpose{font-size:36px;color:var(--ink-light);margin:3px 0 12px}.condition{display:grid;grid-template-columns:88px 1fr;gap:20px;margin-top:10px;align-items:baseline}.condition p{font-size:38px;line-height:1.65}.boundary p{color:var(--ink-light)}.page{padding:54px 60px}main{width:960px}p,.condition p{font-size:42px;line-height:1.65}.tag,.eyebrow,.source{font-size:30px}.condition{grid-template-columns:88px 1fr;gap:20px}.option h3{font-size:46px}.purpose{font-size:40px}.map{padding:24px 0;border-top:1px solid var(--hairline)}.map h2{font-size:44px;line-height:1.6;font-weight:400}.map .where{font-size:36px;line-height:1.6;color:var(--accent);margin-top:10px}.map p{font-size:40px;margin-top:8px}.navigation{border-top:1px solid var(--hairline);margin-top:32px;padding-top:18px;font-size:36px;line-height:1.7;color:var(--ink-light)}.takeaway h2{font-size:42px}.takeaway p{font-size:40px}",
        "variant": "comparison-notes"
      }
    }
  ]
}
