{
  "schema_version": 3,
  "job_id": "wandering-uncertainty",
  "publish_target": "social-single",
  "source": {
    "kind": "pasted-text",
    "language": "zh",
    "label": "据用户提供的不确定性文章片段整理；本次为用户明确要求的同源设计对照"
  },
  "source_units": [
    {
      "id": "reading",
      "excerpt": "用户正文截图说明年轻听众无法预知哪条路能让自己幸福，因此难以行动。核心导读将一种完美主义解释为试图消灭后悔的可能，并提出以20年后不选哪件事最遗憾破除纠结。换问法不等于预测幸福。开放提问属于编辑性阅读问题，并非疗效承诺或用户经历。",
      "evidence": {
        "kind": "claim",
        "strength": "primary",
        "freshness": "current"
      }
    }
  ],
  "decision": {
    "mode": "sketchnote",
    "tier": "studio",
    "tone": "sharp",
    "selection_source": "user-override",
    "reason": "用户明确要求sketchnote现有方案与漫游札记同源对照；不虚构经历或失败"
  },
  "outputs": [
    {
      "id": "wandering-uncertainty",
      "artifacts": [
        {
          "artifact_index": 1,
          "id": "wandering-uncertainty",
          "basename": "uncertainty.png",
          "role": "reflection",
          "source_unit_ids": [
            "reading"
          ],
          "transformation": "visualize",
          "visual_plan": {
            "core_message": "换问法提供选择的支点，并不能保证未来一定幸福。",
            "content_type": "story",
            "argument_structure": "reflective-arc",
            "visual_metaphor": "同一条未尽小路前后出现，红色注视圈从未来问号移回当前位置；问号和虚线始终保留，表示提问支点变化而非未来被解决。第二次意象嵌入新问句旁的空白，不单增一个图段。",
            "layout_strategy": "原文、字号、行宽及断行保持第三轮；首处页边小路注视未知终点，核心提问旁回看起点；使用已有空白完成意象变化，保持总高度。",
            "visual_hierarchy": [
              "问题标题",
              "处境与转向",
              "理解边界与开放问题"
            ],
            "avoid_patterns": [
              "脏背景",
              "虚构个人经历",
              "虚构历史尝试",
              "以图像代替条件"
            ]
          }
        }
      ],
      "render_contract": {
        "mode": "sketchnote",
        "tone": "sharp",
        "title": "一定知道会幸福，才迈出下一步？",
        "composition_required": true,
        "source": "据用户提供的不确定性文章片段整理",
        "content_html": "<header class=\"head\"><p class=\"k\">野生肯尼 · 漫游札记 / 不确定性</p><h1>一定知道会幸福，<br>才迈出下一步？</h1></header><p>别人劝她去尝试。她卡住的却是：不知道哪条路，会让自己真正幸福。</p><div class=\"demand\"><p>先保证不会后悔，才能开始吗？</p></div><p class=\"muted\">文中把这种要求解释为：<span class=\"whole\">试图消灭后悔的可能。</span></p><figure class=\"scribble\"><svg xmlns=\"http://www.w3.org/2000/svg\" viewBox=\"0 0 300 115\" aria-hidden=\"true\"><g fill=\"none\" stroke=\"var(--ink-muted)\" stroke-width=\"2.5\" stroke-linecap=\"round\"><path d=\"M34 90 Q105 50 230 40 M34 96 Q130 76 248 76\" stroke-dasharray=\"5 8\"/><circle cx=\"35\" cy=\"90\" r=\"7\" fill=\"var(--accent-1)\" stroke=\"none\"/><path d=\"M245 20 Q280 22 267 42 Q253 48 260 59 M260 68 V71\"/><ellipse cx=\"260\" cy=\"47\" rx=\"34\" ry=\"39\" stroke=\"var(--accent-1)\" stroke-width=\"3\"/></g></svg></figure><h2 class=\"pivot\">试着把问题翻过来</h2><section class=\"question\"><p class=\"muted\">文中给出的问法</p><p><span class=\"line\">20年后，没有选择哪件事，</span><span class=\"line\">会让自己更遗憾？</span></p><figure class=\"return-sketch\"><svg xmlns=\"http://www.w3.org/2000/svg\" viewBox=\"0 0 300 115\" aria-hidden=\"true\"><g fill=\"none\" stroke=\"var(--ink-muted)\" stroke-width=\"2.5\" stroke-linecap=\"round\"><path d=\"M34 90 Q105 50 230 40 M34 96 Q130 76 248 76\" stroke-dasharray=\"5 8\"/><circle cx=\"35\" cy=\"90\" r=\"7\" fill=\"var(--accent-1)\" stroke=\"none\"/><path d=\"M245 20 Q280 22 267 42 Q253 48 260 59 M260 68 V71\"/><ellipse cx=\"35\" cy=\"87\" rx=\"28\" ry=\"25\" stroke=\"var(--accent-1)\" stroke-width=\"3\"/><path d=\"M68 92 Q92 103 121 100\" stroke=\"var(--accent-1)\"/></g></svg></figure></section><p class=\"after\">换问法提供选择的支点，<span class=\"whole\">并不能保证未来一定幸福。</span></p><p class=\"muted open\">留一个问题：如果答案仍不清楚，<span class=\"whole\">下一次可以观察什么？</span></p><p class=\"muted footer-note\">路仍未看清，先把这个问题记下来。</p>",
        "custom_css": ".question{position:relative}.return-sketch{position:absolute;right:0;bottom:22px;width:210px;height:81px;margin:0}.return-sketch svg{width:210px;height:81px}",
        "variant": "wandering-notes"
      }
    }
  ]
}
