{
  "schema_version": 3,
  "job_id": "wechat-cover-pair-example",
  "publish_target": "wechat-cover",
  "source": {
    "kind": "pasted-text",
    "language": "mixed",
    "label": "Fictional cover-pair fixture: a long original headline about Agent context reuse and Token efficiency"
  },
  "source_units": [
    {
      "id": "context-reuse",
      "excerpt": "虚构样例：Agent 复用上下文。在示例测量中，质量不变，Token 成本降低 7%。",
      "evidence": {
        "kind": "claim",
        "strength": "primary",
        "freshness": "current"
      }
    }
  ],
  "decision": {
    "mode": "editorial-image",
    "tier": "studio",
    "tone": "technical",
    "selection_source": "taxonomy",
    "reason": "An explicitly requested wide and square adaptation of one fictional claim."
  },
  "outputs": [
    {
      "id": "wide",
      "artifacts": [
        {
          "artifact_index": 1,
          "id": "cover-wide",
          "basename": "cover-pair.wide.png",
          "role": "cover",
          "source_unit_ids": [
            "context-reuse"
          ],
          "transformation": "compress",
          "visual_plan": {
            "core_message": "示例测量中，质量不变，Token 成本降低 7%。",
            "content_type": "idea",
            "argument_structure": "single-claim",
            "visual_metaphor": "把反复携带的上下文收进可复用的抽屉。",
            "layout_strategy": "Horizontal title beside reusable-context drawer",
            "visual_hierarchy": [
              "title",
              "qualification",
              "context drawer"
            ],
            "avoid_patterns": [
              "cropping the wide PNG",
              "unqualified savings claim",
              "invented attribution"
            ]
          }
        }
      ],
      "render_contract": {
        "mode": "editorial-image",
        "use": "cover",
        "aspect": "wechat-cover",
        "editorial_tone": "technical",
        "title": "Agent 减负 7%",
        "subtitle": "示例测量中，质量不变，Token 成本降低 7%。",
        "kicker": "样例 · 非真实测量",
        "visual_metaphor": "把反复携带的上下文收进可复用的抽屉。",
        "composition_required": true,
        "content_html": "<section class=\"pair\"><div class=\"copy\"><p class=\"eyebrow\">样例 · 非真实测量</p><h1>Agent 减负 7%</h1><p class=\"deck\">示例测量中，质量不变，<span>Token 成本降低 7%。</span></p></div><div class=\"cabinet\" aria-hidden=\"true\"><div class=\"folder\"><div class=\"tab\"></div><i></i><i></i><i></i></div><div class=\"drawer\"><span></span></div></div></section>",
        "custom_css": ".pair { flex: 1; min-height: 0; padding: 56px 72px; display: grid; grid-template-columns: 1.4fr 1fr; align-items: center; gap: 48px; } .copy { min-width: 0; } .eyebrow { font: 400 24px/1.4 var(--zh-serif); color: var(--ink-light); margin-bottom: 24px; } .pair h1 { font: 400 62px/1.15 var(--zh-serif); margin: 0 0 24px; } .deck { font: 400 36px/1.6 var(--zh-serif); color: var(--ink-light); } .cabinet { position: relative; height: 270px; width: 280px; justify-self: center; } .folder { position: absolute; left: 24px; top: 30px; width: 232px; height: 180px; padding: 42px 26px; border: 1px solid var(--hairline); border-radius: var(--radius); background: var(--surface-1); } .tab { position: absolute; left: 16px; top: 0; width: 64px; height: 16px; background: var(--accent); } .folder i { display: block; height: 1px; margin-bottom: 20px; background: var(--hairline); } .drawer { position: absolute; left: 0; bottom: 0; width: 280px; height: 110px; border: 1px solid var(--hairline); border-radius: var(--radius); background: var(--surface-2); display: grid; place-items: center; } .drawer span { width: 60px; height: 16px; border: 1px solid var(--ink-light); border-radius: var(--radius); } .deck span { white-space: nowrap; }"
      }
    },
    {
      "id": "square",
      "cover_adaptation_of": "wide",
      "artifacts": [
        {
          "artifact_index": 1,
          "id": "cover-square",
          "basename": "cover-pair.square.png",
          "role": "cover",
          "source_unit_ids": [
            "context-reuse"
          ],
          "transformation": "compress",
          "visual_plan": {
            "core_message": "示例测量中，质量不变，Token 成本降低 7%。",
            "content_type": "idea",
            "argument_structure": "single-claim",
            "visual_metaphor": "把反复携带的上下文收进可复用的抽屉。",
            "layout_strategy": "Compact vertical stack: centered text and context drawer share one axis; content-sized rows keep the visible gap near 70px.",
            "visual_hierarchy": [
              "title",
              "qualification",
              "context drawer"
            ],
            "avoid_patterns": [
              "cropping the wide PNG",
              "unqualified savings claim",
              "invented attribution"
            ]
          }
        }
      ],
      "render_contract": {
        "mode": "editorial-image",
        "use": "cover",
        "aspect": "square",
        "editorial_tone": "technical",
        "title": "Agent 减负 7%",
        "subtitle": "示例测量中，质量不变，Token 成本降低 7%。",
        "kicker": "样例 · 非真实测量",
        "visual_metaphor": "把反复携带的上下文收进可复用的抽屉。",
        "composition_required": true,
        "content_html": "<section class=\"pair\"><div class=\"copy\"><p class=\"eyebrow\">样例 · 非真实测量</p><h1>Agent 减负 7%</h1><p class=\"deck\">示例测量中，质量不变，<span>Token 成本降低 7%。</span></p></div><div class=\"cabinet\" aria-hidden=\"true\"><div class=\"folder\"><div class=\"tab\"></div><i></i><i></i><i></i></div><div class=\"drawer\"><span></span></div></div></section>",
        "custom_css": ".pair { flex: 1; min-height: 0; padding: 56px 72px; display: grid; grid-template-columns: 1.4fr 1fr; align-items: center; gap: 48px; } .copy { min-width: 0; } .eyebrow { font: 400 24px/1.4 var(--zh-serif); color: var(--ink-light); margin-bottom: 24px; } .pair h1 { font: 400 62px/1.15 var(--zh-serif); margin: 0 0 24px; } .deck { font: 400 36px/1.6 var(--zh-serif); color: var(--ink-light); } .cabinet { position: relative; height: 270px; width: 280px; justify-self: center; } .folder { position: absolute; left: 24px; top: 30px; width: 232px; height: 180px; padding: 42px 26px; border: 1px solid var(--hairline); border-radius: var(--radius); background: var(--surface-1); } .tab { position: absolute; left: 16px; top: 0; width: 64px; height: 16px; background: var(--accent); } .folder i { display: block; height: 1px; margin-bottom: 20px; background: var(--hairline); } .drawer { position: absolute; left: 0; bottom: 0; width: 280px; height: 110px; border: 1px solid var(--hairline); border-radius: var(--radius); background: var(--surface-2); display: grid; place-items: center; } .drawer span { width: 60px; height: 16px; border: 1px solid var(--ink-light); border-radius: var(--radius); } .pair { padding: 100px 108px; grid-template-columns: 1fr; grid-template-rows: auto auto; align-content: center; gap: 40px; } .copy { width: 100%; max-width: 720px; justify-self: center; text-align: center; } .pair h1 { font-size: 88px; } .deck { max-width: 720px; font-size: 36px; } .cabinet { width: 440px; height: 370px; } .folder { left: 32px; width: 376px; height: 270px; padding: 64px 40px; } .folder i { margin-bottom: 32px; } .drawer { width: 440px; height: 150px; } .deck span { white-space: nowrap; }"
      }
    }
  ]
}
